eventid,url,dates,location,date,text,issue,event
AWGs CCWG1,http://www.iisd.ca/vol12/enb12425e.html,10-14 August 2009,"Bonn, Germany",13 August 2009,"With Bonn III passing the midway point, taking stock of progress and - more importantly - figuring out how to move forward in Bangkok were among the key topics in the corridors. Emerging from informal consultations under the AWG-LCA on the organization of work late in the evening, delegates expressed divergent views on the state of play under the AWG-LCA. Several characterized progress as ""painfully slow,"" while the more optimistic ones believed that the fruits of their labor would become clearer after the facilitators of the various informal session reported on inroads made towards consolidating text on Thursday. The issue of attributing proposals in the negotiating text came up in various AWG-LCA groups throughout the day, and countries reportedly debated over the topic in the evening's informal meeting. Developing countries cited concerns relating to transparency and complained that the negotiating text (sometimes referred to as ""the brick"") was ""confusing,"" with one adding that ""our proposals have been lost, issues dear to us have been marginalized and the text no longer represents the parties."" Many developed country delegates, however, disagreed. One delegate said he was ""floored"" by the issue of attribution since this was not what had been agreed to in Poznan. He explained that attributing text at this juncture would constitute a step back, taking into account the more than 2000 brackets in the document, and detract from substantive discussions. Sighing with despair he wondered: ""When will we ever take collective ownership of this text?"" Under the AWG-KP, the informal group on Annex I emission reductions proved popular as Annex I parties continued to clarify their pledges and the underlying assumptions. While some participants seemed almost excited, describing the sessions ""interesting"" and ""necessary,"" questions returned to reference years and the role of LULUCF. ""Without clarity on LULUCF rules for the second commitment period, the national targets are just not comparable,"" sighed one delegate. Another questioned the utility of discussing individual country targets, stating ""if we want to judge the effect of our commitments on the atmosphere, we have to look at all the targets together."" The role of carbon markets and offsetting also featured significantly in the day's discussions - especially as they were taken up by both AWGs. While the vast majority agreed that the carbon market will continue beyond 2012 and the main focus was on the details of the existing and proposed mechanisms, some more fundamental questions continued to float in the meeting rooms and corridors. One AWG-KP delegate expressed concern that, ""Annex I countries are attempting to shift the burden of mitigation onto developing countries."" Another voiced concern that the low-hanging fruit would soon be out of reach for developing countries. Some developed country delegates, however, were happy to see what they felt was positive movement by some developing countries. ""Today, we were able to discuss details of sectoral crediting and trading with some major developing countries asking detailed questions - this is something that has not happened before,"" commented one negotiator.",425,Bonn Climate Change Talks - August 2009
AWGs CCWG1,http://www.iisd.ca/vol12/enb12426e.html,10-14 August 2009,"Bonn, Germany",14 August 2009,"On the penultimate day of the meeting, many non-papers and consolidated texts were distributed under the AWG-LCA and AWG-KP, and delegates rapidly tried to digest the substance to voice their reactions during the sessions. Many were pleased with the progress on consolidating text under the AWG-LCA up to this point, noting that they had not expected to engage in line-by-line negotiations at Bonn III anyway. ""Fortunately it seems that we have reached the peak in terms of the length of text. At first I thought it was going to balloon even more, but I am comforted now by the very efficient work done on consolidation."" Others, however, were concerned that in the consolidating process, their proposals had been left out, and they were not so pleased with the process. In the afternoon, so many delegates lined up for a copy of the REDD-plus text that a second printing was required. Delegates were anxious to see how their proposals had been incorporated following three days of informal meetings with the facilitator, which many delegates felt were ""positive"" and ""reassuring."" Some enthusiastic parties and observers began analyzing the text in the corridors to prepare for Friday's session. One delegate said, with hope, ""this text represents a solid chance to make some progress on REDD."" However, participants following some of the other AWG-LCA issues expressed frustration at ""beating around the bush on issues"" in some of the informal groups. One frustrated delegate stated that ""we can't continue to tinker around the edges of issues"" and eventually we will have to ""crack the tough nuts"". During the evening informal meeting under the AWG-LCA on the organization of work, delegates reportedly discussed whether they were comfortable continuing with the same working methodology in Bangkok as here in Bonn. Based on the fact that not all the sections of the text were covered this week, some suggested continuing the Bonn working method for at least part of the time in Bangkok, and transitioning into substantial negotiations after a few days. Some delegates expressed frustration with this, with one stating ""Why can't we just jump into negotiations on day one in Bangkok? We are wasting time."" Noting uneven progress in the informal groups, some delegates hoped substantial work could begin in contact groups at least on those issues where it was possible. One developed country negotiator believed some issues are ready to go for Bangkok, such as technology and adaptation and even certain aspects of mitigation. However, one developing country said jumping too fast might have ""adverse impacts with unintended consequences."" Many agreed that more clarity on the way forward might exist after the informal groups conclude their work on Friday.",426,Bonn Climate Change Talks - August 2009
AWGs CCWG7,http://www.iisd.ca/vol12/enb12429e.html,28 September - 9 October 2009,"UNCC, Bangkok, Thailand",29 September 2009,"In the aftermath of various high-level climate change events, including the UN Secretary-General's Climate Change Summit in New York, many delegates arrived in Bangkok wondering whether new impetus would be injected into the UNFCCC process. Most agreed that some fresh energy and a change of gears were necessary given the ""intimidating workload"" and rapidly approaching deadline. At the document center, several delegates expressed dismay with the AWG-LCA documentation amounting to nearly 800 pages in its entirety. ""At this rate, we'll be negotiating well into next year,"" opined one delegate. On Monday evening, however, it seemed that the pace of the negotiations was, indeed, changing. The exceptionally busy first day saw the AWG-LCA barely pausing for breath, let alone lunch: less than half an hour after the opening plenary, parties were already plunging into the contact groups sessions - some of which lasted well past 6 pm. The atmosphere in both AWGs was also more electric than at previous meetings and several debates on sensitive issues surfaced during the afternoon sessions. Given that the EU and other developed countries expressed support for a single agreement, candid discussions took place under the AWG-KP on the Protocol's fate: whether it would survive beyond the first commitment period, and if not, what would happen to the existing rules, institutions and mechanisms, including the Marrakesh Accords. One senior negotiator worried that if ""Kyoto is absorbed into a broader agreement, are we going to have to renegotiate the entire thing?"" Under the AWG-LCA, the afternoon's contact group on mitigation proved to be fairly charged as strong divides persisted between the US and several other developed countries on the one hand, and India and many other developing countries on the other, concerning whether and how to consider common mitigation actions by all parties. Some delegates emerging from the room looked stressed or disappointed, characterizing the tension as a step backwards and feeling unsure as to where things were headed. However, at the same time, many also seemed excited that gears were finally changing and things were starting to happen: ""This is the real thing now,"" commented one inspired seasoned egotiator.",429,Bangkok Climate Change Talks - 2009
AWGs CCWG7,http://www.iisd.ca/vol12/enb12430e.html,28 September - 9 October 2009,"UNCC, Bangkok, Thailand",30 September 2009,"After the sparkles and electricity on Monday, delegates seemed to settle into a determined pace - with an awareness, however, that sensitive issues continue to loom around the corner and that the fruits of their labor will come under close scrutiny in just a couple of months. Agreement was reported from informal consultations by the AWG-LCA Chair in the morning to discuss proposals related to common mitigation actions by all parties in the contact group on mitigation. This started off the day on a positive note and cleared the road for scheduling meetings for the suspended mitigation sub-groups on sub-paragraphs 1(b)(i) and 1(b)(ii) of the BAP on Wednesday. For the mitigation sub-group on REDD-plus, Tuesday was already a busy day with two contact group meetings. One delegate commented that she ""felt like the REDD-plus group was the A+ student,"" as the group has shaved off almost ten pages of the AWG-LCA's negotiating text and has plans to start negotiating the consolidated text at its next meeting on Saturday. Many other AWG-LCA groups also seemed keen to get moving and establish procedures to delve into the negotiating text. This gave hope to some negotiators that substantial shortening of the negotiating text might be possible at this session, although others were still pessimistic about the prospects. On the AWG-KP side, the spin-off group on LULUCF met informally, agreeing on priorities for discussion and noting the anticipated submission of LULUCF reports from three parties on Wednesday. The group on Annex I emission reductions, however, continued broad discussions on how to get around long-standing issues, such as coordination with the AWG-LCA and top-down versus bottom-up approaches. One delegate noted that in order to begin working on text the group would first have to resolve the ""big picture issues"" - ""I'm just wondering whether, where and when that is going to happen.""",430,Bangkok Climate Change Talks - 2009
AWGs CCWG7,http://www.iisd.ca/vol12/enb12431e.html,28 September - 9 October 2009,"UNCC, Bangkok, Thailand",1 October 2009,"During another busy day at the Bangkok Climate Change Talks, several negotiating groups managed to delve deeper into the details. Delegates were, however, reminded of the urgency of their work, particularly adaptation for vulnerable populations, as news continued to stream in on extreme events throughout Asia, including typhoon Ketsana. ""While we cannot attribute individual events to climate change, this news provides examples of the kind of extreme weather events that we should be thinking about,"" said one delegate as he emerged from the adaptation meetings. In addition to several contact group meetings, the AWG-LCA Chair held an informal meeting on Wednesday afternoon focusing on the form of the agreed outcome. ""The legal nature of the outcome was not on the agenda, but we were discussing the document or documents that might come out of Copenhagen,"" explained one negotiator. Another remarked that it was difficult, if not impossible, to isolate discussions on form from discussions on legal nature, continuing: ""I think that the number of lawyers in the room might be a testament to that notion."" Exchanges in the room reportedly covered various ideas on the form of the agreed outcome, including: a single document; a series of documents on each element of the BAP; or a hybrid model comprising a core document and complementary documents that elaborate on the details. Building on these ideas, others mentioned a ""Marrakesh type"" of process. ""We are all chiseling away at the various pieces of the document to build a structure, but we don't know what kind of structure we are building,"" one exacerbated delegate said. Another delegate jokingly confessed to being perplexed by the variety of metaphors used: ""We talked about whether we are trying to build townhouses or a tower and about two elephants and how one would react if her elephant friend died. We also discussed mixing all the ingredients together so they are cooked before Copenhagen.""",431,Bangkok Climate Change Talks - 2009
AWGs CCWG7,http://www.iisd.ca/vol12/enb12432e.html,28 September - 9 October 2009,"UNCC, Bangkok, Thailand",2 October 2009,"With stocktaking plenaries under both AWGs scheduled for Friday, many delegates were overheard exchanging views on where things stand after four days of negotiations in Bangkok. Few, however, seemed to have a clear idea of how to characterize the pace of the negotiations. ""I must confess I am a bit confused,"" said one: ""Sometimes it feels like we've made a lot of progress - and at other times it seems like there will not be enough time to finish everything that needs to be done before Copenhagen."" Another questioned whether the consolidation exercise under the AWG-LCA had actually led to any shortening of the text, with parties insisting on keeping their proposals in the document. ""Well, we've indeed clarified our positions but this does not mean we've created any space for compromise, rather we've further illuminated our differences,"" he said pessimistically. Many of those emerging from the morning's mitigation contact group under the AWG-LCA were willing to admit that positions had been clarified - with some also conceding that ""important differences"" between developed and developing countries had been elucidated. Nevertheless, others were optimistic. One developed country delegate characterized the discussions as a ""fundamental breakthrough,"" noting that, for the first time, proposals for mitigation architecture were discussed in a formal setting and parties provided ""starker relief"" of their proposals and expectations. Emerging from the room, some delegates also remarked on Thursday's events in the US, including the introduction of the Boxer-Kerry climate bill in the Senate and the regulation of greenhouse gases by the Environmental Protection Agency under the Clean Air Act, wondering how these would impact the negotiations. Discussions also took place in the corridors and meeting rooms concerning the overall legal architecture and the Protocol's future. Some commented on new support for the proposal made by Tuvalu earlier in the week to consider the legal implications that would arise if the Protocol was subsumed under a new agreement in Copenhagen and how this would affect the Protocol's rules, institutions and mechanisms. ""There seems to be growing acknowledgment that this needs to be discussed - somewhere,"" said one party.",432,Bangkok Climate Change Talks - 2009
AWGs CCWG7,http://www.iisd.ca/vol12/enb12433e.html,28 September - 9 October 2009,"UNCC, Bangkok, Thailand",3 October 2009,"Most delegates came to Bangkok agreeing that important progress must be achieved during the meeting in terms of narrowing down and clarifying options, otherwise agreement in Copenhagen will not be possible. Many therefore considered the stocktaking exercises on Friday as important milestones towards measuring progress under each AWG. The UNFCCC Executive Secretary's press conference on Friday afternoon sent a signal of encouragement, as he expressed confidence that rules and tools can be developed in Bangkok and Barcelona will enable Copenhagen to succeed. ""Yes, we can,"" was also the slogan that a Swiss delegate displayed on the screen during the AWG-LCA's stocktaking session - a sentiment shared by many others wanting to believe that agreement in Copenhagen is still within reach. However, even the most optimistic were ready to admit that further progress during the second week will be essential. Many also suspected that such progress is by no means guaranteed. To be sure, pessimistic views were aired during the stocktaking meetings. Even stronger sentiments were expressed by some NGO representatives in the corridors: ""Progress is painfully slow, and everyone is chiseling away around the edges, and I worry that we are wasting time and money by being here."" Some veterans characterized progress as uneven: ""There are areas where we are advancing - but there are also crucial questions where we have not seen any significant movement."" Issues identified by some as areas where good progress was being made included adaptation, capacity building and technology under the AWG-LCA, and LULUCF and potential consequences under the AWG-KP. On the ""sticking points,"" many identified mitigation and finance as the key ones. Most predicted that mitigation would be particularly challenging to resolve: under the AWG-KP, the G-77/China said parties were ""stuck at a place where we cannot bridge the gap"" and reiterated the need for commitments by Annex I countries consistent with science. Some speculated how a proposal by the EU under the AWG-LCA to compile emission reduction pledges from all Annex I countries would influence the dynamics. ""While broadening discussions on developed country contributions might help, there is also the question of developing country mitigation to consider,"" noted another delegate. The breadth of the ground to cover in that area was evident from a comment by one developing country delegate on a proposal by a developed country on mitigation: ""The problem is not that I don't understand the nature of the proposal - on the contrary, the problem is that I do."" On the way to move things forward, the AWG-LCA stocktaking session bore witness to calls from some parties to give the Chair a mandate to consolidate the text further with a view to accelerating progress. As one delegate said emerging from the evening session, ""something more has to be done, this text still needs so much work, and it's now or never if we want to make progress."" However, several developing country delegates, while acknowledging that further consolidation was required, said the process still had to be ""party-driven"" and based on work done during the week.",433,Bangkok Climate Change Talks - 2009
AWGs CCWG7,http://www.iisd.ca/vol12/enb12434e.html,28 September - 9 October 2009,"UNCC, Bangkok, Thailand",5 October 2009,"On Saturday, work continued at the Bangkok Climate Change Talks, both in formal and informal settings. On the informal side, groups convened under the AWG-LCA to discuss different aspects of mitigation, including mitigation by developed countries under sub-paragraph 1(b)(i) of the BAP. Delegates emerging from the informals on developed country mitigation reported that the focus had been on a new document indicating paragraphs that might be merged, and that the proposed technical paper on ""numbers"" had also been discussed. ""There seemed to be support for compiling the technical paper,"" noted one participant, but added: ""We did not really agree on the details, including the scope, methodology or timing of such work."" In the afternoon, the AWG-LCA Chair convened an informal meeting on ""organization of text."" One delegate explained that the meeting related mainly to organization of the AWG-LCA's work on finance and its means of implementation, which is reflected throughout the negotiating text. Delegates emerging from the room reported that no major controversies surfaced during the meeting. ""While many see finance as one of the ""deal breakers"" in Copenhagen, this was mostly an organizational discussion,"" said one party after the meeting. Overall, while several meetings were held throughout the day, many noted that the corridors of UNESCAP felt ""quiet and empty"" compared to the frenzy of activities on Friday. Many participants were overheard discussing their plans for Saturday evening (the traditional NGO party was featured at the top of the list) and for Sunday: ""I can certainly use this short break - next week will involve very hard work,"" remarked one delegate as she exited the UN building.",434,Bangkok Climate Change Talks - 2009
AWGs CCWG7,http://www.iisd.ca/vol12/enb12435e.html,28 September - 9 October 2009,"UNCC, Bangkok, Thailand",6 October 2009,"As the Bangkok Climate Change Talks continued on Monday, a lively demonstration took place outside the UNESCAP building as a reminder to delegates of the rapidly approaching Copenhagen meeting and the growing interest in their work outside the walls of the conference center. Inside the building, work resumed through various formal and informal meetings. Many of the day's meetings under the AWG-LCA were characterized by some participants as ""technical."" The AWG-LCA contact group on overall mitigation issues, for instance, focused on organization of text and work, and the contact group on mitigation under sub-paragraph 1(b)(i) of the BAP held a short meeting on the consolidation of the negotiating text. While the contact group on finance also held a rather technical discussion on a new non-paper, several delegates coming from the room were heard commenting on the new US proposal on finance. ""What I think is positive about the proposal is that it would be scaling up financial resources,"" said one delegate. Another skeptical one commented: ""I'm not sure how the mechanism would be different from the existing framework. It seems like the same game with a different name."" Under the AWG-KP, the morning's meeting on the relationship between Annex I parties' ""numbers"" and the market mechanisms proved so popular that an additional meeting had to be scheduled on the topic. After the discussions on issues such as environmental integrity, the impact of market mechanisms ""as the atmosphere sees them,"" the need for investment signals in the form of a carbon price and the role of ""hot air,"" many of those emerging from the room characterized the discussions as ""interesting,"" ""positive"" and ""useful."" One developed country delegate explained: ""Developed and developing countries still have different views on whether targets should be defined before the rules on other issues, or vice versa, and we definitely need to discuss this more. This was just the beginning."" ""Our views are still far apart, but it was a relatively good discussion,"" said another. Many informal groups also convened during the day, including on: a shared vision and sectoral approaches under the AWG-LCA; and on LULUCF and potential consequences under the AWG-KP. Emerging from the informal meeting on the scope of a shared vision, delegates were cautiously optimistic. One said: ""We had remarkably similar positions on the need for a long-term global goal to be at the center of a shared vision."" Another commented: ""While the form of the outcome is still up in the air and parties had diverse ideas on how a shared vision will be presented in the agreed outcome, there was new support for the idea that we are not going to Copenhagen just to create an aspirational and inspirational political declaration.""",435,Bangkok Climate Change Talks - 2009
