eventid,url,dates,location,date,text,issue,event
COP 17 - CMP7,http://www.iisd.ca/vol12/enb12529e.html,28 November - 9 December 2011,"Durban, South Africa",5 December 2011,"Reflecting on the first week in Durban, some delegates pointed to a less frenzied atmosphere than the highly-charged Copenhagen COP or the more positive but ""logistically-challenged"" Cancun COP. That said, there was some excitement in Durban on Saturday, with thousands of protesters marching outside, while inside delegates worked feverishly on a multitude of texts. SBI and SBSTA plenaries met and concluded their work, although they forwarded several issues to the COP. With more than 130 pages of AWG-LCA text to review and revise, negotiators left the conference center late Saturday night with plenty of homework for Sunday and early Monday. Large sections of the text have been under discussion since Panama. However, parties will need to do more work on level of ambition, market mechanisms and long-term financing, among others, if they are to get to a ""party-driven, balanced and equitable outcome."" Under the AWG-KP, three options on the form and limit of a second Kyoto commitment period were emerging, though participants noted that no consensus had yet emerged. As expected, the COP Presidency quietly moved the ""indaba"" sessions among the parties behind closed doors to encourage frank conversations. Some delegations were suggesting that ""subtle changes"" could be detected and that, rather than simply making demands, parties were starting to seek ""mutual reassurances"" that divides could be bridged. The dynamics within the BASIC group were still unclear to some, as was the broader response to the EU's proposal for how a package deal might emerge and its desire for a timetable towards a broader agreement. As participants discussed how a package might take shape, many noted that the future of the Kyoto Protocol and its mechanisms are at the heart of the matter, along with operationalizing the Green Climate Fund and the other elements of the Cancun Agreements. Another major question being asked in Durban is whether the AWG-LCA will finish its work four years after it was created. Many felt it may need more time. The complexity of knitting these elements into a coherent and acceptable Durban outcome with just one week remaining has many participants worried. ""We see good progress on some technical issues, but the geopolitics are difficult and it is just not clear that all the trade-offs can be reconciled,"" said one delegate. As negotiations resume on Monday, there will be a push to complete agreement on a further round of issues and to sharpen options for ministers when they step in on Tuesday.",529,Durban Climate Change Conference - COP17/CMP7
COP 17 - CMP7,http://www.iisd.ca/vol12/enb12530e.html,28 November - 9 December 2011,"Durban, South Africa",6 December 2011,"With a second wave of participants arriving in Durban for the last week, the intensity in the hallways increased. In the morning plenary, after reviewing the AWG-LCA text, some delegates complained that the lengthy text was disproportionately weighted to mitigation issues. ""It's time we start discussing adaptation,"" said one negotiator, while another anxiously wondered whether we ""will ever get anything concrete under response measures."" Outside the negotiating room, high-level officials began outlining their positions. During press conferences, China laid out five conditions for participating in a legally-binding climate deal to come into force after 2020 and Brazil signaled that they wanted a ""robust, legally-binding instrument and not just any instrument."" The EU continued to seek support for their proposal on a roadmap for a legally-binding agreement, with several AOSIS delegates indicating their strong preferences for early action under both tracks and ""setting clear deadlines."" The US called for all countries to take on comparable legal commitments, even if the timelines for implementation might be different. Meanwhile, Indabas convened off-site by the COP Presidency appear to have became a popular place for problem solving. As issues that need political resolution are being defined, in the next few days teams of Ministers are expected to be assigned to consult with parties on key issues in order to further advance the work toward a balanced outcome.",530,Durban Climate Change Conference - COP17/CMP7
COP 17 - CMP7,http://www.iisd.ca/vol12/enb12531e.html,28 November - 9 December 2011,"Durban, South Africa",7 December 2011,"On Tuesday, the arrival of heads of government and Ministers was evident from the pace of negotiations. Throughout the day delegates worked at full speed and continued meeting late into the night to meet a deadline for the preparation of draft decisions. They were instructed to refine lists of possible options, to be taken up for political resolution by Ministers. After listening to the reports from AWG-LCA and KP Chairs, however, several delegates commented that it is by no means clear that all issues will be resolved by the end of the conference. Meanwhile, in the corridors, a visibly exhausted veteran negotiator emerging from a packed room said ""deliberations on the GCF are hard,"" while another experienced negotiator said that an agreement is achievable but pushing too hard may leave the GCF ""an empty shell."" As the COP Presidency announced that they will now elevate the Indaba meetings to ministerial level, a delegate expressed hope that the Zulu form of participatory democracy would inspire a decisive search for common ground. In the evening, the UNFCCC Secretariat launched ""Momentum for Change,"" a new initiative celebrating adaptation and mitigation success stories. One of the delegates reflected ""when we're locked away in rooms arguing, we need to remember that climate change affects peoples' lives.""",531,Durban Climate Change Conference - COP17/CMP7
COP 17 - CMP7,http://www.iisd.ca/vol12/enb12532e.html,28 November - 9 December 2011,"Durban, South Africa",8 December 2011,"As the countdown to the close of the conference began and the Indaba negotiation sessions entered a critical high-level round, one observer noted that the question now is whether a political gap would join the gaps in ambition, finance and implementation. The South African hosts have tabled iterations of the 'big picture' outlining how ministers might 'mix and match' options that would deliver a second commitment period under the Kyoto Protocol and the steps to a possible new legally-binding instrument under the Convention or other alternatives to implement the Bali Action Plan and Cancun Agreements. ""They have their work cut out for them,"" said one senior delegate, while another pondered that given the current financial crisis and slow pace of the Green Climate Fund negotiations, there may not be enough ""carrots"" for large developing countries to alter staunch positions. One significant negotiating position, that of China, has been widely anticipated following some confusion over their reference to ""pinning down commitments."" An observer noted that the comparability of undertakings by developed countries and large emitters will prove the toughest challenge for ministers, an issue that may not be resolved at this meeting. The final 48+ hours of the negotiations are expected to witness a ministerial-led process of political decision-making coupled with a frenzy of parallel meetings on dozens of outstanding technical matters.",532,Durban Climate Change Conference - COP17/CMP7
COP 17 - CMP7,http://www.iisd.ca/vol12/enb12533e.html,28 November - 9 December 2011,"Durban, South Africa",9 December 2011,"Amid cautions that ""Durban cannot send a message to do nothing,"" delegates were pushed to agree on final details of a possible Durban package. At an Indaba meeting to discuss technical issues, delegates reiterated their preferences in terms of legal options for an outcome and one delegate lamented the lack of compromise from key parties citing a reggae song ""everybody wants to go to heaven but nobody wants to die."" Another delegate said discussions regarding the launch of another negotiating process seemed like a ""replay of Bali."" With the final day of negotiations approaching, ministers had a flurry of bilateral meetings, followed by a political Indaba that went into the twilight hours. Perhaps learning a lesson from the ""leaked texts"" of Copenhagen, the COP President posted iterations of the ""big picture"" papers for all to see. While in the corridors, some observers scanned updates of the Indaba papers, including options for the future of the Kyoto Protocol; some delegates despaired that complexity was taking over and an ambitious outcome would be impossible in the time remaining, with one invoking dark memories of the final hours of Copenhagen and another simply stating ""we won't be sleeping tonight."" On a brighter note, one visibly relieved delegate said ""we are finally making progress on the GCF,"" while an observer mustered that unless sources of funding are clearly identified, it will be ""more of the same."" Yet, another reflected that commitments on mitigation, and not the GCF, remain the core test for the ""political will of parties.""",533,Durban Climate Change Conference - COP17/CMP7
SB 36,http://www.iisd.ca/vol12/enb12536e.html,14-25 May 2012,"Bonn, Germany",15 May 2012,"The Bonn Climate Change Conference opened on a sunny Monday morning. The mood of delegates gathering in the familiar surroundings of the Maritim Hotel was positive, although many joked that they now know the city and conference venue by heart. ""We've had nearly a 6-month break in the formal negotiations, but many of us have already been spending quite a bit of time in Bonn recently for workshops and the informal meeting in early May."" While the surroundings were well-known, there was also a feeling of anticipation regarding the post-Durban process, including the newly established ADP. Many commented that they were looking forward to commencing work under the new ADP on Wednesday; however, few seemed to have a clear sense of the timeline and substance. Meanwhile, the various new bodies were generating new dynamics in the process, ripe with rumors that nominations were proving difficult. This was confirmed in the evening, with the SBI plenary finishing business for the day without having resolved the process of how nominations for the various bodies should be considered. As the SBs opened, technology was very much on the agenda. Along with the ubiquitous iPads and iPhones sported by delegates, technology permeated conversation in the corridors with delegates expressing different views on the host of the CTC. The importance of resolving the issue came up in the SBSTA, SBI and a press conference with UNFCCC Executive Secretary Christiana Figueres. Some delegates favored the Caribbean as host, others emphasized the need for the CTC to be in a developing country, while one recommendation noted the Republic of Korea as an option due to their technological advancements. Whatever the case, technology will remain a key part of the climate conversation in Bonn.",536,Bonn Climate Change Conference - May 2012
SB 36,http://www.iisd.ca/vol12/enb12537e.html,14-25 May 2012,"Bonn, Germany",16 May 2012,"On the second day, the opening plenaries of the AWG-KP and AWG-LCA were the focus of the negotiations in the Maritim. Both AWGs are scheduled to terminate their work in Doha, and face considerable pressure to ""finally"" fulfill their mandates. The delegates' challenge is therefore to ensure that they ""die respectfully and with dignity,"" as the Chinese delegate phrased it in the AWG-LCA opening plenary. While the AWG-KP swiftly began its work, the AWG-LCA was bogged down with discussions on the agenda, as parties' views diverged on the way forward. While some non-Annex I countries believe that the elements of the Bali Action Plan should provide the foundation for the AWG-LCA's work, some of the other non-Annex I countries and Annex I countries supported the view that ""evolution since Bali,"" including outcomes from Cancun and Durban, should form the basis of the AWG-LCA's work in 2012. ""The agenda is not static,"" said one developed country delegate. ""If we treat it as such, it's like taking three steps back and ignoring all the hard work we've done since Bali in 2007."" Some delegates in the corridors suspected that bringing back elements from the Bali Action Plan could be a strategy from those reluctant to let the AWG-LCA ""die in Doha."" But delegates did concede that many have different interpretations of what has been agreed since the creation of the AWG-LCA at COP 13 in Bali, and feel that issues could be discussed but that conclusions do not need to be reached on all issues. When the AWG-LCA opening plenary was suspended at 7:00 pm, the agenda had still not been adopted. Informal consultations will follow. Exiting the plenary hall, some feared that the ""Bangkok ghost"" would rear its head in Bonn, recalling the AWG-LCA meeting in April 2011 when the agenda was not agreed until the last day. Meanwhile, nominations for posts in the ADP, the Green Climate Fund Board and other bodies were also a hot topic in the corridors. Rumor has it that there were still many positions left to fill, with some proving to be highly controversial within regional groups and potentially delaying meetings already scheduled.",537,Bonn Climate Change Conference - May 2012
SB 36,http://www.iisd.ca/vol12/enb12538e.html,14-25 May 2012,"Bonn, Germany",17 May 2012,"On the third day in Bonn, many delegates spent the day on substantive discussions on equity and a broad range of topics taken up in the various contact groups and informal consultations under the SBI and SBSTA. Delegates also worked to clarify the way forward under the AWG-LCA in order to avoid stalling work. ""We are working to resolve the issue as fast as possible,"" one delegate said on his way to evening informal consultations on the AWG-LCA agenda. ""We have too much work before Doha to get gridlocked on the agenda."" Later in the evening agreement was reported on the AWG-LCA's agenda. A delegate found in the corridors expressing relief and delight explained that the outcome includes a footnote indicating that the ""consideration of some issues may already have been concluded."" Looking further ahead, however, some worried about financial constraints surrounding the proposed Bangkok meeting and what they alluded to as ""lack of enthusiasm"" from some countries to have an extra session before Doha. With the opening plenary of the ADP scheduled for Thursday, interest is brewing on who will be chairing the new body. With three nominations, and two of them from the G-77/China, delegates speculated on how the issue will be resolved in under 24 hours. The possibility of a late night meeting in order to reach agreement in time for the opening session were among the rumored strategies.",538,Bonn Climate Change Conference - May 2012
SB 36,http://www.iisd.ca/vol12/enb12539e.html,14-25 May 2012,"Bonn, Germany",18 May 2012,"The corridors were once again buzzing with speculations and murmurs of anticipation about the Chairs of the ADP and other outstanding nominations. After enthusiastic opening statements under the ADP in the morning, work under the new body in the afternoon was confined to a brief announcement that consultations on its Chairs remain inconclusive. By the end of the day, parties had not made significant progress on the selection of the Chairs and rumors circulated on the reasons for the deadlock and the possible ways forward. Some speculated that one of the candidates was only willing to accept the position of Chair and not Vice-Chair, while others mentioned that the idea of having two Co-Chairs had also been raised. ""To be honest it's unlikely that a decision will be made in Bonn,"" predicted one delegate, who expressed disappointment at the delay. Those eager to start working stressed that the selection process does not necessarily need to delay negotiations as substantive work could be launched regardless. One delegate even suggested that the COP President provisionally chair the body until a decision has been reached. Others, however, felt that at least one Chair must be appointed before work of the ADP begins. On the Green Climate Fund Board, things were apparently not looking so green as the announcement was made that the Board's first meeting, scheduled for the end of May, was postponed pending the process of nominations. According to one delegate, although most groups have nominated their proposed Board members, others have chosen to go way beyond the call of duty and nominate more than their share of the composition. ""There will be trouble, but I guess we will just have to see until all have submitted nominations,"" said one high-level delegate. As the AWG-LCA contact group closed its meeting late in the evening, the fate of the leadership of the ADP hung in the air, like the GHG emissions that continue to fuel the climate process.",539,Bonn Climate Change Conference - May 2012
SB 36,http://www.iisd.ca/vol12/enb12540e.html,14-25 May 2012,"Bonn, Germany",19 May 2012,"Friday night brought the ADP to the fore once again, and the corridors were filled with both excitement and discontent over the opening plenary of the new body. ""This was quite something,"" commented one delegate exiting the plenary tent. ""I have never seen anything like this,"" declared another. As the ADP plenary convened just before 6 pm, ""intense moments"" followed. Points of orders were the flavor of the night as the session progressed. However, delegates' reaction to the first point of order by China was unexpected and raised a few laughs, as half the room stood up and rushed to the door as soon as the delegate started speaking. Luckily, it had nothing to do with his intervention, but rather the need for headsets and translation to understand the point of order made in Chinese. The mood quickly turned serious again. After legal advice from the Secretariat that COP Bureau members do not represent parties or regional interests, COP Vice-President Van Lierop's passionate assurances that he was acting in the interest of all parties when presiding over the ADP was met by thundering applause. Because of the unresolved issue of the ADP Bureau members, the prospect of the ballot box was mooted in plenary just in case the controversy over the Chair of the ADP was not finally resolved through ""less radical"" means. Exiting the plenary, one relieved delegate sighed, ""That was a lucky escape, I thought I was going to have to cast my vote tonight.""",540,Bonn Climate Change Conference - May 2012
SB 36,http://www.iisd.ca/vol12/enb12541e.html,14-25 May 2012,"Bonn, Germany",21 May 2012,"As delegates prepared to unwind at the traditional NGO party on Saturday night and enjoy a well-deserved day off on Sunday after a rather frenetic week, many reflected on the ""drama"" that had unfolded in the ADP and AWG-LCA over the past few days, in particular regarding agendas and the organization of work. Many were speculating on whether procedural issues would continue to take center stage during the final week of discussions. ""The worst case scenario is that we leave Bonn without even adopting the ADP agenda if things continue at this rate,"" said one seemingly frustrated delegate, who went as far as to argue that a diverse coalition of ""anti-ADP parties"" were intent on obstructing proceedings. Another one remarked, however, that progress under the ADP is unlikely until more progress is achieved under the AWG-KP and AWG-LCA, especially on developed country QELROs. Enjoying a light moment, some delegates joked that the provisional ADP Chair [woman's] ample multitasking skills perhaps might be severely stretched in attempting to overcome the agenda impasse. ""Well, I've heard that the plan is just to get the process up and running by trying to resolve the organizational issues in Bonn and then hopefully adopt a programme of work in Doha before beginning work in earnest in 2013. If we don't, it's not going to be good for the process."" Whether the Bangkok session will actually be held is another area of uncertainty, with indications that the Bureau has yet to make a decision on this. ""We really will need an additional meeting before Doha if progress continues at this languid pace,"" said a weary negotiator heading out of the Maritim.",541,Bonn Climate Change Conference - May 2012
SB 36,http://www.iisd.ca/vol12/enb12542e.html,14-25 May 2012,"Bonn, Germany",22 May 2012,"After enjoying a sunny and warm Sunday in Bonn, delegates returned reinvigorated on Monday, ready for negotiations. Their adaptive nature was truly tested during some well-attended informal consultations. ""There's only so much adapting one can do,"" joked one delegate on the lack of space in the negotiating room on adaptation and NAPs. Indeed, the space issue extended to other areas of the meeting, including thought-space, once again preoccupied by the crucial question of ambition. This time, the focus of attention was on the day-long ADP workshop, which was initially entitled ""enhancing mitigation ambition"" until some developing countries insisted on a broader focus, so that it would also cover means of implementation. Several delegates explained that the ""somewhat surprising"" significance given to the workshop's title illustrates the sensitivity concerning the scope of the ADP's work. Ambition prevailed as the overall theme during the event, evident from the scientific presentations, a further reminder that parties will have to start working to achieve more ambitious results well before 2020. As many developing countries continuously reiterated, the pre-2020 mitigation ambition gap is highly relevant under both the AWG-LCA and AWG-KP. It remains, however, highly contentious under the ADP, where the agenda discussions reportedly continued during the day. According to delegates, some developing countries continue to insist on the deletion of the item on workplan on mitigation ambition, while others argue for it to remain, stressing its key role in the Durban package. One insider explained: ""The difference is that the AWG-LCA and AWG-KP place the pre-2020 emphasis on developed countries, whereas the ADP is mandated to look at all parties."" Thankfully, in other quarters, the atmosphere was less somber than under the ADP, described by some as ""tense."" During informal consultations on sectoral approaches congeniality prevailed and butter cookies were even offered to sweeten discussions.",542,Bonn Climate Change Conference - May 2012
SB 36,http://www.iisd.ca/vol12/enb12543e.html,14-25 May 2012,"Bonn, Germany",23 May 2012,"On Tuesday, delegates' views on progress diverged. As some groups under the Subsidiary Bodies concluded their work, the ADP continued to struggle to get substantive work started. After ""yet another round"" of procedural plenary discussions in the morning, the ADP moved into a smaller informal setting for the evening. Initial discussions during the informal meeting focused on areas where assurances on the agenda discussion are needed, including the ADP's role in enhancing ambition. Parties also reflected on ways to find a balance between the three working groups. Five proposals to move out of the procedural deadlock were also reportedly being considered into the evening, no doubt adding to the complexity of the task at hand. Reflecting on the negotiating dynamics, many delegates commented on the relationship between the three Ad Hoc Working Groups. Some noted that a ""nautical theme"" seemed to be emerging as some developing countries expressed concern over developed countries attempting to ""jump ship"" from the AWG-KP and AWG-LCA to the ADP when it comes to mitigation ambition. One delegate lamented: ""Developed countries seem eager to lay the AWG-LCA to rest and place the emphasis on the ADP; where is the equity in that."" Like any effort to navigate deep seas, a sense of direction and timing is key. With the morning report that an intersessional in Bangkok before Doha is now appearing ""unlikely,"" many delegates expressed an added sense of urgency for clarity on the way forward: ""These are indeed stormy waters for the ADP; it is difficult at this stage to see the horizon in the distance,"" opined one negotiator.",543,Bonn Climate Change Conference - May 2012
