eventid,url,dates,location,date,text,issue,event
SB-22,http://www.iisd.ca/vol12/enb12266e.html,19-30 May 2005,"Bonn, Germany",24 May 2005,"A number of participants at SB 22 have commented on an apparent shift in China's engagement in the climate change process. While some observers believe the Group of 77 is occupying familiar ground, they argue that China's role has increased in line with its emerging status as a major economic power'and that its positions on some issues may be shifting, too. Some see the environmental fallout from China's rapid industrialization as a key driver of that country's approach. The view is that China anticipates trouble ahead and has decided to help shape the architecture of the climate regime so as to minimize shocks further down the road. According to some experts, another driver could be China's engagement with the WTO regime. Observers have also noted closer collaboration between China and Japan, as the two countries eye-up opportunities for drawing down mutually beneficial environmental and economic rewards from the climate regime.",266,United Nations Framework Convention on Climate Change: Twenty- Second Session of the Subsidiary Bodies
SB-22,http://www.iisd.ca/vol12/enb12267e.html,19-30 May 2005,"Bonn, Germany",25 May 2005,"Memories of COP 9 and COP 10 plenary exchanges on the LDC Fund returned to the corridors Tuesday as delegates began to suspect that they were about to relive the inconclusive negotiations, in the style of the 'Groundhog Day' Hollywood film about someone fated to repeat the same day again and again. Since COP 8's decision that further guidance for the operation of the LDC Fund would have to be developed for the GEF, negotiators from both sides seem to feel they have been starting over at each day of each session. Some attributed the sense of d'j' vu to a rushed decision at COP 9, and handing over the initiative to the GEF Council at the expense of LDC delegates. Likewise, there were signs the budget negotiations could also take a repetitive turn.",267,United Nations Framework Convention on Climate Change: Twenty- Second Session of the Subsidiary Bodies
SB-22,http://www.iisd.ca/vol12/enb12268e.html,19-30 May 2005,"Bonn, Germany",26 May 2005,"Delegates were celebrating in several contact groups Wednesday at the completion of their work. In particular, the conclusion of discussions on non-Annex I Parties' submissions of national communications, which have been under negotiation for two and a half years, resulted in 'a collective sigh of relief,' according to one observer. Meanwhile the decision to forward ongoing debates over the Special Climate Change Fund to Montreal was a sign of SB 22's 'technical' and 'low key' nature, according to several participants. 'At this stage, anything remotely political or problematic will likely end up on the COP or COP/MOP's plate,' said one delegate.",268,United Nations Framework Convention on Climate Change: Twenty- Second Session of the Subsidiary Bodies
SB-22,http://www.iisd.ca/vol12/enb12269e.html,19-30 May 2005,"Bonn, Germany",27 May 2005,"Delegates seemed relieved at the completion of most of SBI's work late on Thursday night, although not everyone was celebrating. With agreement on the programme budget for 2006-2007 still elusive as of 12:30 am Friday morning, some delegates left the meeting clearly frustrated. On the other hand, celebrations at a final agreement on a decision on LDCs appeared genuine, although tempered by a few comments that the result was not as strong as some would have liked. There also seemed to be real satisfaction at the significant step towards concluding work on another longstanding agenda item relating to Croatia's base year emissions. However, frustrations were evident in some quarters over the short text on several issues, such as mitigation and climate neutral UNFCCC meetings.",269,United Nations Framework Convention on Climate Change: Twenty- Second Session of the Subsidiary Bodies
IPCC-24,http://www.iisd.ca/vol12/enb12273e.html,22-28 September 2005,"Montreal, Canada",23 September 2005,"The corridors of the ICAO building were quiet throughout the first day of WGIII-8, as most delegates were to be found in the plenary room participating in an exhaustive, and possibly exhausting, line-by-line review of the draft SPM text. Several participants wondered about the pace of progress, noting that only four of 32 paragraphs had been addressed. One observer noted that while the discussion ranged from the substance of CCS to comma placement, all aspects of the discussion are important given the need to provide policy makers with a comprehensive and readable summary of CCS. Another delegate remarked on the level of involvement of a wide range of delegates in the deliberations, noting that this should help to ensure that the resulting text reflects the consensus of IPCC members, in keeping with the spirit of the organization.",273,8th Session of WG- III and IPCC-24
IPCC-24,http://www.iisd.ca/vol12/enb12274e.html,22-28 September 2005,"Montreal, Canada",24 September 2005,"The workday stretched into the late hours of the night. Despite the amount of text left to consider and the limited time in which to do it, the atmosphere remained upbeat throughout the day. Several IPCC veterans seemed unsurprised at the long days and speed of progress. Some delegates noted that the momentum and good will from the morning session began to give way to more serious disagreements as the day progressed, though they expressed hope that this trend would reverse on Saturday.",274,8th Session of WG- III and IPCC-24
IPCC-24,http://www.iisd.ca/vol12/enb12275e.html,22-28 September 2005,"Montreal, Canada",26 September 2005,"The corridors began to fill up as the plenary emptied throughout the last day of WGIII-8, with more informal contact groups convening to consider particular sections of the draft SPM. While the day began with some pessimism as to whether the remaing text of the draft SPM could be agreed by the scheduled closing time, steady progress during the afternoon seemed to take many delegates by surprise. By the 6.00 pm dinner break, some participants were prepared to lay wagers as to the finishing time, with one optimistic delegate suggesting 8.00 pm, while more seasoned observers suggested that 12.00 am was more realistic. In the end, experience had its way.",275,8th Session of WG- III and IPCC-24
IPCC-24,http://www.iisd.ca/vol12/enb12276e.html,22-28 September 2005,"Montreal, Canada",27 September 2005,"After the late nights and detailed nature of deliberations towards the end of WGIII-8, the tone of the opening day of IPCC-24 appeared more relaxed. Some delegates speculated that the second day of IPCC-24 might be more intensive, particularly given that a number of potentially controversial issues were held over for discussion until later in the meeting. Along with the timing of the AR4 Synthesis Report, attention both in the corridors and in plenary shifted to consideration of election procedures, emission scenarios, aerosols, outreach and the budget. One issue that caught the passing attention of many delegates was Minister Dion's reference to COP-11 and COP/MOP-1 as the 'Climate Change Conference.' Most thought this was simply a matter of word choice, but one observer wondered if the changing terminology represented a desire to shift the attention towards 'climate change' more generally.",276,8th Session of WG- III and IPCC-24
IPCC-24,http://www.iisd.ca/vol12/enb12277e.html,22-28 September 2005,"Montreal, Canada",28 September 2005,"Several delegates noted that disagreements regarding election procedures seemed to reflect diverging views of the IPCC's dual roles as a scientific and an intergovernmental body. One observer, noting the polarized positions on election procedures, expressed pessimism about whether the issue would be resolved at IPCC-24. From the reported success of an evening contact group on the issue, he could prove to be wrong.",277,8th Session of WG- III and IPCC-24
COP 11 - CMP 1,http://www.iisd.ca/vol12/enb12281e.html,28 November - 9 December 2005,"Montral, Canada",29 November 2005,"Most delegates arriving at the conference center on Monday morning seemed in good humor despite the long lines to register and get through security. In the corridors, much of the discussion was on Canadian politics and what the implications of an election might be on the conference. Several delegates said they were encouraged by Minister Dion's statement committing himself to his work as COP President, and that while the election campaign would be an interesting backdrop to the meeting, it should not affect the meeting outcome. One delegate noted, however, that it was not the possible impacts on the next two weeks that bothered him, but rather the possibility that Minister Dion might not be the COP President after January.",281,Eleventh session of the Conference of the Parties to the Climate Change Convention and first meeting of the Parties to the Kyoto Protocol
COP 11 - CMP 1,http://www.iisd.ca/vol12/enb12282e.html,28 November - 9 December 2005,"Montral, Canada",30 November 2005,"SBI plenary discussions on the relationship between the GEF and the COP spilled into the hallways on Tuesday, as several delegates drew linkages between these discussions and donor differences over the size of the fourth GEF replenishment. Some already seem unhappy with the way the GEF operates, feeling that possible funding cuts would make it an even less appealing option. The introduction of the RAF also drew criticism from some, who noted that the RAF would make it more difficult for developing countries to access funding. However, others appeared more optimistic about the impact that the RAF might produce.",282,Eleventh session of the Conference of the Parties to the Climate Change Convention and first meeting of the Parties to the Kyoto Protocol
COP 11 - CMP 1,http://www.iisd.ca/vol12/enb12283e.html,28 November - 9 December 2005,"Montral, Canada",1 December 2005,"Corridor chatter on Wednesday started with rumors that Bill Clinton and Al Gore might make an appearance next week to push the agenda along. By lunchtime the focus of many delegates had shifted to relief and pleasure at the COP/MOP's adoption of the Marrakesh Accords, which some had quietly feared might prove difficult. By the close of the day, though, the mood had turned sour for some following Saudi Arabia's insistence on amending the Kyoto Protocol at this COP/MOP ' an issue many fear could prove among the most difficult to manage in the days ahead. This prompted one delegate to suggest that Clinton and Gore's presence might indeed help to 'save the day.'",283,Eleventh session of the Conference of the Parties to the Climate Change Convention and first meeting of the Parties to the Kyoto Protocol
COP 11 - CMP 1,http://www.iisd.ca/vol12/enb12284e.html,28 November - 9 December 2005,"Montral, Canada",2 December 2005,"The action on Thursday moved out of plenary and into contact groups and informal consultations. Some issues ' such as UNFCCC Article 6 or the international transaction log ' did not cause much of a sensation outside the room. However, the group on Protocol Article 3.9 (future commitments) held late in the evening certainly did cause a stir in the corridors, not least because it was so well attended that many could not even get through the door. This is the issue one delegate dubbed, 'the 800 pound sleeping gorilla we've all been trying not to wake!' However, with three proposals already on the table and 300 delegates squeezing into a room designed to hold about 100, the 'sleeping gorilla' could be about to wake.",284,Eleventh session of the Conference of the Parties to the Climate Change Convention and first meeting of the Parties to the Kyoto Protocol
COP 11 - CMP 1,http://www.iisd.ca/vol12/enb12285e.html,28 November - 9 December 2005,"Montral, Canada",3 December 2005,"Much of the gossip on Friday evening was over a high-level meeting COP President Dion held with representatives of each of the major negotiating groups. Apparently, Dion presented a non-paper on an approach to considering future scenarios under the Convention. This approach, which is different to treating future commitments under Protocol Article 3.9, is likely to fuel considerable debate. The initial response was mixed, with enthusiasm in some quarters but a more muted response in others. 'This could potentially be the big outcome of the meeting, but it will be a complicated task' observed one delegate. Meanwhile, the contact groups were rather less sensational. While a few agreements were reached on issues such as UNFCCC Article 6, the LDC Expert Group and Annex I communications, efforts to grind out results in many other groups were far less successful. As of Friday night, some participants were expressing concerns at a lack of movement on financial issues, compliance, mitigation, and implications of the CDM for other environmental treaties. 'If this was a race, the snail would have beaten us today,' said one delegate. However, a veteran negotiator noted that the pace always seems to slow at this time of the meeting. Perhaps in recognition of the heavy workload, Saturday's daily programme has meetings scheduled into the evening. 'This could upset some people's plans to attend the NGO party or the Montreal Canadiens' ice hockey game,' joked one participant.",285,Eleventh session of the Conference of the Parties to the Climate Change Convention and first meeting of the Parties to the Kyoto Protocol
COP 11 - CMP 1,http://www.iisd.ca/vol12/enb12286e.html,28 November - 9 December 2005,"Montral, Canada",5 December 2005,"While the corridors were a little less crowded on Saturday, dedicated negotiators gave no indications that the weekend was a time to relax. Intense discussions continued in numerous contact groups and consultations. 'This is the unglamorous but critical part of the meeting where we try to sort out the technical matters before the politicians arrive next week,' explained one participant. Some meetings were more productive than others. Delegates emerging from a few groups were in celebratory mood: participants dealing with the 'little known but nevertheless important' international transaction log finished their work, as did those engaged on LULUCF methodological issues. However, CDM, finance and other issues remained unresolved as of Saturday evening. Discussions on Article 3.9 (future commitments) and the financial mechanism seemed to create the most frustrations. Article 3.9, in particular, continued to be the subject of considerable discussion in the corridors as news continued to spread that the COP/COP-MOP President had consulted heads of delegation on a proposal on future work linked to the Convention, not the Kyoto Protocol. There were also rumblings in the corridors that at least one key delegate in a major negotiating group is 'polarizing' positions both within and outside the group. Some participants were focused more on what was happening outside the conference center, as thousands descended on central Montreal to demand action on climate change. 'Let's just hope the politicians arriving next week find out about this,' said one NGO participant.",286,Eleventh session of the Conference of the Parties to the Climate Change Convention and first meeting of the Parties to the Kyoto Protocol
COP 11 - CMP 1,http://www.iisd.ca/vol12/enb12287e.html,28 November - 9 December 2005,"Montral, Canada",6 December 2005,"Delegates were expressing growing concerns about divisions in negotiations on Monday night. Although several less controversial issues were resolved, arguments over financial matters and the mechanisms intensified, with at least one 'shouting match' breaking out between delegates. According to talk in the corridors, a major point of contention is over how to make the mechanisms more attractive. Moves by developing countries to impose a levy on joint implementation projects to fund the Adaptation Fund were not well received by JI hosts and investors that stand to gain from JI. The proposal prompted what one participant called 'a tit-for-tat response' from the Russian Federation aimed at increasing the levy on CDM ' the mechanism focused on developing countries. 'It's like a competition between JI and CDM, with each side trying to make their mechanism more attractive to investors,' alleged one expert. 'This is the time to be taking issues off the negotiating table, not adding them,' said another. Others were more sanguine: 'This will go down to the wire on Friday, and it's too early to expect Parties to give up any negotiating chips just yet,' explained a veteran. Meanwhile, informal consultations on Article 3.9 (future commitments) were still continuing late into Monday night. Delegates outside the room seemed confused as to what exactly was going on, and about how President Dion's latest initiative on future scenarios under the UNFCCC related to Article 3.9 talks.",287,Eleventh session of the Conference of the Parties to the Climate Change Convention and first meeting of the Parties to the Kyoto Protocol
COP 11 - CMP 1,http://www.iisd.ca/vol12/enb12288e.html,28 November - 9 December 2005,"Montral, Canada",7 December 2005,"On a very late night for SBSTA, some delegates were heard expressing their disappointment that the Mauritius Strategy for SIDS failed to make it onto the agenda of this SBSTA. Although many Parties appeared to favor consideration of this item, the US was vigorous in its objections, citing procedural issues. ""Small island States are being drowned out by the large mainland States,"" alleged one observer. For its part, the US has argued forcefully that the issue has already been given thorough consideration in other fora and that this is not the right place for this discussion. In other news, several delegates appeared optimistic about President Dion's initiative on moving forward under the Convention following Dion's meeting Tuesday lunchtime with ministers at the InterContinental Hotel.",288,Eleventh session of the Conference of the Parties to the Climate Change Convention and first meeting of the Parties to the Kyoto Protocol
COP 11 - CMP 1,http://www.iisd.ca/vol12/enb12289e.html,28 November - 9 December 2005,"Montral, Canada",8 December 2005,"Many negotiators breathed a sigh of relief on Wednesday as work on compliance and the CDM was completed two days before the end of the meeting. As one negotiator said, this now leaves time for discussing ""the really important stuff"" - a clear reference to future actions. Opinions on this issue seem split among those favoring an approach under Protocol Article 3.9 on future commitments, those leaning towards an approach under the Convention, and those who seem comfortable with a ""twin-track approach."" Australia's apparent sympathy for Dion's initiative also drew some comments from those who saw it as a contrasting approach to that of the US. There was also increasing talk about discussions under Protocol Article 9, which refers to a review of the Protocol by COP/MOP 2. As rumors swirled about progress - or lack thereof - in the various informal discussions, several participants were heard welcoming the involvement of former UNFCCC Executive Secretary Michael Zammit Cutajar. ""The more sensible heads around now, the better,"" said one veteran of the process.",289,Eleventh session of the Conference of the Parties to the Climate Change Convention and first meeting of the Parties to the Kyoto Protocol
COP 11 - CMP 1,http://www.iisd.ca/vol12/enb12290e.html,28 November - 9 December 2005,"Montral, Canada",9 December 2005,"Progress on Article 3.9 on Thursday night had some delegates smiling but 'vaguely confused.' The agreement on a bracketed decision that sets out various options for how to proceed was being interpreted as 'highly unusual but still a positive outcome' by one insider. Further high-level discussions were taking place late on Thursday night on the entire package of issues. While news from the small group negotiations was positive, some concerns were being expressed about the dwindling numbers in plenary. Many ministers and high-level officials were left to address a largely empty hall, prompting several delegates to propose a more 'interactive' approach involving thematic roundtables and panel discussions. However, no one disputed the overall usefulness of the high-level segment, which increases visibility and political commitment to the process, and allows for a multitude of bilateral meetings to take place. In other talk, many participants seemed excited at the imminent prospect of former US President Bill Clinton's visit on Friday.",290,Eleventh session of the Conference of the Parties to the Climate Change Convention and first meeting of the Parties to the Kyoto Protocol
IPCC-25,http://www.iisd.ca/vol12/enb12293e.html,26-28 April 2006,"Port Louis, Mauritius",27 April 2006,"Delegates at IPCC-25 were in good spirits on Wednesday, despite having an ambitious agenda to get through and a number of potential pitfalls in the way. Newcomers to the process may have felt that progress in plenary was slow going, but veteran observers were more sanguine. One observer's prediction that the meeting would include the 'usual mischief making' seemed well placed, as discussions on the 2006 Guidelines were held up on a couple of technical and procedural issues. Progress was also protracted, as several participants expected, on flooded lands. With only one day of the meeting gone, the mood at the close of the session remained upbeat, even though many delegates had to forgo the evening reception to continue contact group discussions, and many were scheduled to return early on Thursday morning for more of the same. Several delegates were optimistic that momentum would increase over the next two days.",293,IPCC-25
IPCC-25,http://www.iisd.ca/vol12/enb12294e.html,26-28 April 2006,"Port Louis, Mauritius",28 April 2006,"Contact group discussions on the role of the IPCC in emissions scenarios spilled out into the corridors on Thursday, with many viewing this issue as a key indicator of the future direction and role of the IPCC in the coming years. Different views among participants were evident, with some delegates viewing the role of the IPCC as one of coordination, while others said it should have more of an assessment role. Regardless of which view eventually emerges from discussions today, many delegates seem convinced that this debate will continue to be a feature of IPCC meetings in the future. In light of a comment made in the emissions scenario contact group that the IPCC must not be seen to be 'hopping into bed with the climate modeling community,' delegates joked that the traffic in Port Louis might not have been the only reason for the late arrival of some participants to the meeting on Thursday morning.",294,IPCC-25
SB 24,http://www.iisd.ca/vol12/enb12298e.html,15-26 May 2006,"Bonn, Germany",18 May 2006,"UNFCCC Executive Secretaries old and new were being discussed in the corridors on Wednesday. The first topic of conversation was the late start of the AWG's first meeting, which was pushed back from 10:00 am to 1:00 pm. The delay was due to disputes over the leadership of this new group that will deal with the sensitive issue of post-2012 commitments under Protocol Article 3.9. Apparently, there was some North-South/regional jostling over positions and also over the length of time the bureau would serve, with some preferring a one-year term over the two years served by SBI and SBSTA chairs. The consultations resulted in former UNFCCC Executive Secretary Michael Zammit Cutajar ' a highly respected figure in the climate process ' taking the chair, and Brazil's Luiz Alberto Figueiredo Machado accepting the Vice-Chair's post. However, disputes apparently remain over whether the rapporteur's position will go to a developing country or an economy-in-transition. There was also speculation over the next UNFCCC Executive Secretary, with some delegates noting that the UNFCCC Bureau had not yet been presented with a name by the 'powers that be' at UN headquarters in New York, although a shortlist was announced more than two months ago. However, one insider expected a decision 'within weeks rather than months.' Finally, early rumors about the possible venue of COP 13 and COP/MOP 3 in 2007 were already swirling, even though a decision is not due until COP 12 later this year. With 2007 being Asia-Pacific's turn to host the meeting, there was speculation that one south-east Asian nation might be interested. 'I won't say who, but it's north of Malaysia and begins with the letter 'T''.oh, and the capital is Bangkok,' added one rather transparent participant.",298,Twenty- Fourth sessions of the Subsidiary Body for Scientific and Technological Advice (SBSTA) and the Subsidiary Body for Implementation (SBI) of the UNFCCC and First session of the Ad Hoc Working Group on Further Commitments for Annex I Parties under the Kyoto Protocol (AWG) and related meetings
