eventid,url,dates,location,date,text,issue,event
INC 11,http://www.iisd.ca/vol12/1202000e.html,6-17 February 1995,"New York, USA",7 February 1995,"On Monday, delegates agreed that AOSIS could present its draft protocol to the Committee on Wednesday. This protocol, which calls for a reduction of emissions of greenhouse gases by at least 20% by the year 2005, has been the subject of discussion in the corridors and during the intersessional period. It appears as though an agreement has been reached whereupon there will be no negotiation of this protocol until the COP. Although the Chair made the point that the protocol might be discussed during Working Group I""s review of the adequacy of commitments on Wednesday afternoon, few expect much progress at this session.",2,Eleventh Session of The INC for the Framework Convention on Climate Change (UNFCCC)
INC 11,http://www.iisd.ca/vol12/1203000e.html,6-17 February 1995,"New York, USA",8 February 1995,"The Climate Action Network has been actively lobbying G-77 countries to endorse the AOSIS draft protocol, which calls for a reduction of emissions of greenhouse gases by at least 20% by the year 2005. Meanwhile, others are trying to convince delegates that such a protocol is unnecessary. The fate of the protocol is still uncertain both within the G-77 and in the Committee as a whole. With so much concern over the adequacy "" or inadequacy "" of commitments, as evidenced by the crowds in Working Group I, many are looking forward to the discussion on this matter.",3,Eleventh Session of The INC for the Framework Convention on Climate Change (UNFCCC)
INC 11,http://www.iisd.ca/vol12/1204000e.html,6-17 February 1995,"New York, USA",9 February 1995,"The bidding war is on. Canada, Germany, Switzerland and Uruguay are actively campaigning to be selected as the host for the Permanent Secretariat. While Bonn and Geneva may be the front runners, there is clearly no consensus yet. For Canada, Switzerland and Uruguay a decision at INC-11 would be to their advantage. If a decision is postponed until COP-1, Bonn is clearly the favorite. But then, as one delegate pointed out, there is always the possibility that the decision will be postponed by COP-1 and that Geneva could remain the ""interim"" location for the foreseeable future.",4,Eleventh Session of The INC for the Framework Convention on Climate Change (UNFCCC)
INC 11,http://www.iisd.ca/vol12/1205000e.html,6-17 February 1995,"New York, USA",10 February 1995,"As the debate on Joint Implementation (JI) ""heats"" up, divisions between developing countries based on divergent interests and priorities are becoming apparent. It is clear from Article 4(2)(a) of the Convention that JI can take place between Annex I Parties. Discussion on broadening JI to include developing countries was first initiated at INC-8, raising developing countries' concerns about its potential implications and impacts. Developing countries have viewed JI with varying degrees of skepticism and caution. Concerns have once again been expressed that Annex I Parties should not use JI as a means to avoid meeting their current commitments under the Convention and that JI agreements should not substitute for funding mechanisms under the Convention. However, the position of some developing countries appears to be changing. There are those who favor limiting the JI pilot phase only to Annex I Parties and others who are more amenable to the voluntary and equitable participation of developing countries. There appears to be some agreement among developing countries that the thorny problem of the allotment of greenhouse gas abatement credits and a ""baseline"" be excluded from the pilot phase.",5,Eleventh Session of The INC for the Framework Convention on Climate Change (UNFCCC)
INC 11,http://www.iisd.ca/vol12/1206000e.html,6-17 February 1995,"New York, USA",13 February 1995,"It appears as though governments that want to host the Permanent Secretariat have not limited themselves to lobbying other governments. In an interesting role reversal, some government delegates are lobbying NGOs for their support. In the end, however, it will be the governments' decision. As of Friday, consensus had not emerged. The current tally, according to Plenary statements, is: Bonn (2); Geneva (4); Toronto (1); Montevideo (0); and undecided (3).",6,Eleventh Session of The INC for the Framework Convention on Climate Change (UNFCCC)
INC 11,http://www.iisd.ca/vol12/1209000e.html,6-17 February 1995,"New York, USA",16 February 1995,"The OPEC countries are actively lobbying for an amendment to the Rules of Procedure on the composition of the Bureau. Their proposed amendment for Rule 22 (Officers) would add a member of the Bureau from the oil exporting developing countries, to complement the member from the small island developing States. Although this amendment lacks consensus, some delegates fear that it will not be withdrawn and, as a result, the final compromise might have negative implications for their group.",9,Eleventh Session of The INC for the Framework Convention on Climate Change (UNFCCC)
INC 11,http://www.iisd.ca/vol12/1210000e.html,6-17 February 1995,"New York, USA",17 February 1995,"The Contact Group discussing the physical location of the Permanent Secretariat met Thursday afternoon with the representatives of the four countries offering to host the Secretariat - Canada, Germany, Switzerland and Uruguay. While some members of the Group said they had made progress, it appeared as though the Contact Group was not yet in a position to make a recommendation to the Plenary on this matter. It seems that a number of delegations do not have instructions from their capitals on location preferences, should this matter come to a vote on Friday. If the INC is not able to make a recommendation to the COP, it is likely that the decision will not be taken at COP-1. In that case, it may be some time before the Permanent Secretariat has a permanent home.",10,Eleventh Session of The INC for the Framework Convention on Climate Change (UNFCCC)
COP 1,http://www.iisd.ca/vol12/1213000e.html,28 March - 7 April 1995,"Berlin, Germany",29 March 1995,"Environmental NGOs expressed surprise and disappointment that they were not allowed access to the main floor of the Plenary and the COW. Several NGO representatives said that this lack of access to delegates had not been the customary practice in meetings of the INC, particularly given the contribution of environmental NGOs to the work of the Convention. A group of NGOs plan to appeal to the President and the Executive- Secretary to reconsider this matter.",13,First Conference of the Parties to the Framework Convention on Climate Change
COP 1,http://www.iisd.ca/vol12/1214000e.html,28 March - 7 April 1995,"Berlin, Germany",30 March 1995,"While the COW has focused on adequacy of commitments, there is still lobbying in the corridors on the location of the Permanent Secretariat. The Mayor of Bonn invited delegates to a lunchtime Zusammenkunft to discuss the benefits of moving the Secretariat to Bonn. Meanwhile, according to some estimates, the staff costs in Toronto would be lower than Geneva, Bonn or Montevideo. While it appeared as though Geneva was the front-runner at INC-11, the lobbying may be far from over.",14,First Conference of the Parties to the Framework Convention on Climate Change
COP 1,http://www.iisd.ca/vol12/1216000e.html,28 March - 7 April 1995,"Berlin, Germany",3 April 1995,"Consultations abound in the corridors and offices of the ICC. Amb. Estrada has been holding one-on-one informal consultations on joint implementation. By Saturday afternoon, it was still uncertain whether delegates would be able to reach consensus on a JI pilot phase or if Estrada would be able to produce a Chair's text or summary. Estrada informed delegates during the Saturday afternoon COW that these negotiations were moving ""very slowly,"" and that he did not expect to begin further consultations until the G-77 and China had been given additional time to condider the adequacy of commitments. Estrada has also been consulting with delegates from the four countries who wish to host the Permanent Secretariat (Canada, Germany, Switzerland and Uruguay) to try to reach agreement on a method to use to resolve this pending issue.  The Germans continued their consultations with delegates about the Rules of Procedure. Although some delegates had called for agreement on the Rules of Procedure by the end of the first week of the COP, this has not been the case and it appears likely that consultations will continue into the second week. The two major outstanding issues are voting procedures and the allocation of seats on the Bureau. While a linkage between these rules was resisted at INC-11, the impending arrival of ministers may encourage delegates to reconsider.",16,First Conference of the Parties to the Framework Convention on Climate Change
COP 1,http://www.iisd.ca/vol12/1218000e.html,28 March - 7 April 1995,"Berlin, Germany",5 April 1995,"The second round of the ""informal survey"" of delegates on their preference for the physical location of the Permanent Secretariat took place between 6:00 - 7:00 pm. Unlike the first round when 99 out of 114 eligible Parties present at the negotiations participated, only 92 Parties entered Room 5 for the second round. When all the secret ballots were counted, there was still no ""absolute majority"" and Estrada announced that the third round would take place on Wednesday and the choice would be between Bonn and Geneva. The exact time of the third round will be determined by the Bureau on Wednesday morning.",18,First Conference of the Parties to the Framework Convention on Climate Change
COP 1,http://www.iisd.ca/vol12/1219000e.html,28 March - 7 April 1995,"Berlin, Germany",6 April 1995,"Consultations on joint implementation met from Tuesday night until 6:30 am Wednesday morning. With the exception of credits, there appeared to be agreement on most of the text that establishes a JI pilot phase. On Wednesday, small groups of delegates met in the corridors, while trying to avoid video cameras, to forge a compromise. By 7:30 pm, when one developed country delegation said that they were unable to take a final decision until Thursday morning, it became apparent that agreement on JI would have to wait. Meanwhile, consultations on the adequacy of commitments continued. Some participants commented that there has been ""progress"" towards agreeing on a mandate to negotiate or consult on a protocol to be adopted by 1997. The question that remained when the group adjourned at 10:00 pm was just how vague this mandate would be.",19,First Conference of the Parties to the Framework Convention on Climate Change
COP 2,http://www.iisd.ca/vol12/1229000e.html,8-19 July 1996,"Geneva, Switzerland",9 July 1996,"An informal meeting held last week in Frankfurt, sponsored by the government of Germany, formed the basis for closer cooperation between the secretariats of the Convention on Biological Diversity (CBD) and the GEF. According to one participant, relations between the GEF and the CBD are complicated by language in the convention stating that the GEF shall operate under the ""authority"" of the CBD, as well as by the absence of an intersessional mechanism to discuss financial issues (unlike the FCCC). The meeting established a process for consultations between the two bodies in a revised Memorandum of Understanding.",29,Second Conference of the Parties to the Framework Convention on Climate Change
COP 2,http://www.iisd.ca/vol12/1231000e.html,8-19 July 1996,"Geneva, Switzerland",11 July 1996,"At an informal meeting of participants in the Subsidiary Body for Implementation (SBI), Parties agreed to review a Secretariat proposal to raise capital reserves from 8.3% to 15% at COP-3, as well as outstanding questions regarding relocation to Bonn, liaison points in New York and Geneva, and the budget.",31,Second Conference of the Parties to the Framework Convention on Climate Change
COP 2,http://www.iisd.ca/vol12/1232000e.html,8-19 July 1996,"Geneva, Switzerland",12 July 1996,"Observers were heard speculating on the outcome of Thursday night's contact group on the rules of procedure. Some said it could result in an agreement that institutionalizes the status quo, wherein oil-producing states would not receive their own seat on the Bureau but would be assured a regional group seat. Others predicted that some governments were still strongly opposed to this outcome and the group would likely result in a stalemate.",32,Second Conference of the Parties to the Framework Convention on Climate Change
COP 2,http://www.iisd.ca/vol12/1233000e.html,8-19 July 1996,"Geneva, Switzerland",15 July 1996,"NGO reaction varied to news that the Ministerial Round Table will remain closed to observers and the press. Some business NGOs expressed mild concern that the Round Table, which will be opened to all heads of delegations regardless of rank, will result in a de facto Plenary with no opportunity for outside input. Many environmental NGOs said they had not sought entry, in hopes a closed door session would produce tangible progress. Some NGOs of both camps voiced concern on setting a precedent.",33,Second Conference of the Parties to the Framework Convention on Climate Change
COP 2,http://www.iisd.ca/vol12/1237000e.html,8-19 July 1996,"Geneva, Switzerland",19 July 1996,"Two developments at COP-2, the US statement supporting a legally binding agreement to reduce emissions and the Ministerial Declaration, drew several reactions from participants. Regarding the US statement, one delegate expressed concern about the impact of a requirement for tradeable emission permits on a binding agreement. Another delegate mentioned that the AOSIS protocol, and its targets, could be ""dead in the water"". Regarding the Declaration, one observer was surprised at the level of dissent, expressed in heated exchanges between some delegations and the COP officials, minutes before the Plenary was due to note the Declaration.",37,Second Conference of the Parties to the Framework Convention on Climate Change
AGBM 6,http://www.iisd.ca/vol12/1241000e.html,3-7 March 1997,"Bonn, Germany",4 March 1997,"Several AGBM participants commented on developments towards a common position regarding QELROs within one regional economic integration organization. Despite its internal debate on burden sharing, agreement was reached on a common target. Some delegates suggested that this common position could advance the entire AGBM process by sparking a transatlantic debate. In contrast, others characterized the proposed target as ""unrealistic"" and doubted it would be taken seriously. One developing country delegate said the proposal could sharpen AGBM's focus on strengthening developed country commitments, while others noted that the target's timeframe greatly lessens its impact.",41,Sixth Session of the Ad Hoc Group on the Berlin Mandate
AGBM 6,http://www.iisd.ca/vol12/1242000e.html,3-7 March 1997,"Bonn, Germany",5 March 1997,"Several participants provided favorable reviews of the non-group's efforts to fulfill its non-mandate of streamlining the Framework Compilation. One participant reported that the non-group narrowed the options and will submit a revised text to AGBM. Another commented that some delegates appeared unclear on the concept of streamlining and used the meeting as an opportunity to regurgitate lengthy, all too familiar positions.",42,Sixth Session of the Ad Hoc Group on the Berlin Mandate
AGBM 6,http://www.iisd.ca/vol12/1243000e.html,3-7 March 1997,"Bonn, Germany",6 March 1997,"AGBM delegates reported on the progress, or non-progress, of the non-groups. One participant reported that the non-group on advancing existing commitments stalled when participants attempted to cut out anything more than simple duplications in the proposals. Another participant stated that one group of countries opposed even the rearrangement of its proposals. Participants of the non-group on institutions and mechanisms reported that the session agreed on a preamble, definitions, and institutions and processes, but other elements could not be finalized. Another participant said the Chair would still conduct ""technical streamlining"" of outstanding issues.",43,Sixth Session of the Ad Hoc Group on the Berlin Mandate
SB 6 - AG13 5,http://www.iisd.ca/vol12/enb1247e.html,28-31 July 1997,"Bonn, Germany",29 July 1997,"Delegates at an informal budget discussion differed Monday afternoon on the implications of budgetary decisions for AGBM and COP-3 deliberations. Some supported including funds for a possible post-Kyoto process within a proposed contingency budget or even including those funds in the FCCC's core budget, while others said the budget should not prejudge whether coming negotiations will establish such a process. The need for separately listing funds for Annex 1 and non-Annex 1 Parties' implementation was also questioned, but a number of delegations said the distinction in Parties' responsibilities should not be eliminated in the budget. Several delegations also expressed concerns about the apparent increase in staff and overall budget amount compared to 1997 figures and requested further information on these issues from the Secretariat.",47,Sixth Subsidiary Body for Scientific and Technological Advice (SBSTA) and the Subsidiary Body for Implementation (SBI)
SB 6 - AG13 5,http://www.iisd.ca/vol12/enb1249e.html,28-31 July 1997,"Bonn, Germany",31 July 1997,"While speakers in SBI were supporting NGO participation in the FCCC, delegates and observers in the corridors were considering the prospect of NGO access during AGBM being limited to participation in Plenary sessions and daily briefings. Most of the negotiations are planned to take place in four closed informal groups. Some noted that exclusion of NGOs is a necessary response to the pressure on the AGBM to deliver results and that the decision may be designed to accelerate substantive negotiations. Some NGO representatives stated that this arrangement hinders the Convention because, given more access to negotiations, NGOs are able to apply positive pressure. Other NGO representatives noted that this is an unwelcome precedent and now puts the onus on governments to inform NGOs of their decisions.",49,Sixth Subsidiary Body for Scientific and Technological Advice (SBSTA) and the Subsidiary Body for Implementation (SBI)
AGBM 7,http://www.iisd.ca/vol12/enb1250e.html,28 July - 7 August 1997,"Bonn, Germany",1 August 1997,"NON-GROUP ON ARTICLE 4.1 (COMMITMENTS): In the non-group meeting on Article 4.1, delegates agreed to negotiate on the basis of a paper proposed by Chair Evans King (Trinidad and Tobago). The first four paragraphs of the chapeau were discussed, which refer to advancing the implementation of commitments and the Berlin Mandate. Some non-Annex I countries reportedly sought to include references to the Berlin Mandate along with a number of other elements from the FCCC, including a specific reference to no new non-Annex I commitments, but some Annex I countries objected. Some delegations were reluctant to include a reference to the principle of common but differentiated responsibilities. There were proposals to delete paragraphs that conditioned advancement of commitments by non-Annex I Parties on the provision of financial resources and transfer of technology by developed countries. One developed country put forward an alternative draft paper that would commit Parties to advance implementation of Article 4.1 and to a strengthen collaboration.",50,Seventh Session of the Ad Hoc Group on the Berlin Mandate
AGBM 7,http://www.iisd.ca/vol12/enb1251e.html,28 July - 7 August 1997,"Bonn, Germany",4 August 1997,"An international business NGO used the first briefing for observers to protest the decision to hold negotiations in closed non-groups. Business representatives later indicated that they would be discussing the matter with national governments in the hope of reversing the decision in time for AGBM-8 in October. While conceding the requirement for closed negotiations in the latter stages of the process, business representatives expressed dismay at the decision to go into closed sessions when negotiating positions of countries are well known. An environmental NGO representative indicated that the AGBM decision on access had been anticipated. Nevertheless, there were concerns that a precedent has been set - one that will not go unchallenged when NGOs next meet with the AGBM Chair and Parties. To the suggestion that negotiations might advance with more openness in closed sessions, an NGO representative said there had been no evidence of this to date. With non-groups working to cull down the number of positions in working texts, delegates and observers noted little movement on major issues in AGBM negotiations. Discussions outside the non-groups aimed at developing common positions among groups of countries have begun on such issues as the commitments of non-Annex I countries and the basis and form of emissions reductions. Some stated that progress seems slow for this stage of the process, while others commented that clearly defining options is sufficient at this stage.",51,Seventh Session of the Ad Hoc Group on the Berlin Mandate
AGBM 7,http://www.iisd.ca/vol12/enb1252e.html,28 July - 7 August 1997,"Bonn, Germany",5 August 1997,"During the morning observer briefing, business NGO representatives were unsuccessful in challenging the AGBM Chair to clarify his earlier statement that a number of items for discussion are, strictly speaking, not consistent with the mandate of the AGBM. The Chair declined to comment and said these matters were subject to interpretation. The business lobbyists later indicated that they were concerned about references in AGBM documentation to discussion topics on evolution and the possible impacts on developing countries of new commitments, and wondered what precise instructions had been given to non-group chairs for dealing with such issues. While some delegates and observers are giving increasing attention to the impact on employment of potential AGBM outcomes, a number of environmental NGOs have argued that the issue is being manipulated to frighten political constituencies in developed countries. They believe that the success of the strategy has driven some developed Party views on the need to bring developing countries on board the Berlin Mandate process sooner rather than later -- and avoid the alleged economic consequences of unilteral commitments by Annex I countries.",52,Seventh Session of the Ad Hoc Group on the Berlin Mandate
AGBM 7,http://www.iisd.ca/vol12/enb1253e.html,28 July - 7 August 1997,"Bonn, Germany",6 August 1997,"Delegates say that the brief discussions of joint implementation during SBSTA and SBI on Tuesday, point to abiding sensitivities between Annex I and non-Annex I Parties over implementation and potential future commitments. Wary of exploring JI before completing the pilot phase of activities implemented jointly (AIJ) between developed and developing countries, a number of developing country delegates say that opening the issue in the subsidiary bodies could establish it as an issue in future AGBM negotiations, a result they oppose. They also want to ensure that language on ""returning individually or jointly"" to earlier emissions levels applies only to Annex I Parties. Developed countries supporting JI say that it is an appropriate element of future commitments that should be pursued in current negotiations. Although text on JI is being examined in contact groups, this week's decisions are not expected to resolve differences on the issue.",53,Seventh Session of the Ad Hoc Group on the Berlin Mandate
AGBM 7,http://www.iisd.ca/vol12/enb1254e.html,28 July - 7 August 1997,"Bonn, Germany",7 August 1997,"Wednesday's observer briefing ended with the AGBM Chair's comments that the trend of discussion at the extended Bureau meeting was to apply only the FCCC's objective to a Protocol. Within minutes of the announcement, reports of counter trends emerged from some of the interested players who had participated in the Bureau meeting. Some said that a decision to limit the Protocol's objective to that set out in the FCCC could have implications for those proposals from regional groups and other Parties that stipulate or propose the development of formulae for setting a ceiling on GHG emissions based, for example, on sea level and temperature rises. Chair Estrada has, reportedly, argued that the introduction of a new objective may cause confusion. A number of the interested Parties suggested that the matter had not been resolved, and proposals containing new objectives would stay on the table at the AGBM. One regional representative said ""we have not given up."" They marked Estrada's announcement down to ""forceful chairmanship"" and suggested that he was somewhat ahead of the Parties in his reading of Tuesday's meeting. Some also conceded that, in principle, it would be advisable to restrict the introduction of new objectives but arguments would be made for an exception nonetheless. Others said that using the same FCCC overall objective would still leave room to incorporate proposed new objectives, perhaps within the section on emissions limitations and reduction objectives. An interested Party has reportedly been tasked to conduct consultations in an effort to merge the new proposals.",54,Seventh Session of the Ad Hoc Group on the Berlin Mandate
